{"id":"EXE-GEI-GEN1-001","type":"execution","title":"Run structured hydraulic-analogy evaluation","status":"active","version":"1.0.10","execution_status":"planned","decision_ids":["DEC-GEI-GEN1-001"],"investigation_ids":["INV-GEI-GEN1-001"],"action":"Execute the approved comparison and evidence-evaluation protocol.","protocol":["Identify textual observations without interpretation.","Map each proposed hydraulic function to an explicit prediction.","Compare predictions against Genesis passages and relevant historical hydraulic evidence.","Record supporting, neutral, and challenging observations.","Evaluate alternative non-hydraulic explanations."],"observations":[],"evidence_ids":[],"result_ids":[],"deviations":[],"notes":"Execution is planned; no result should be inferred before observations are recorded."}